{
  "decision_id": "decision.synthetic.claim-promote.chronos-carrier",
  "decision_type": "claim_promote",
  "decision_outcome": "deferred",
  "evidence_status_refs": ["artifact.synthetic.causal-triad"],
  "authority_ref": "authority.synthetic.lawful-learning",
  "replay_seal": "sha256:123456789abcdef0123456789abcdef0123456789abcdef0123456789abcdef0",
  "timestamp": "2026-05-13T00:00:00Z",
  "decision_rationale": "Synthetic promotion decision fixture with evidence binding and a CHRONOS carrier trace.",
  "affected_claim_ids": ["claim.structure.hopfield-modern-continuous.M"],
  "non_claims": ["synthetic_decision_not_runtime_authority"],
  "neurosymbolic_carrier": {
    "methodFamily": "NSR-SOFT-CONSTRAINT",
    "carrierStatus": "candidate",
    "claimStatus": "advisory",
    "validationState": "verification_pending",
    "groundingStatus": "not_applicable_or_pending",
    "sourceEvidenceRef": "urn:socioprophet:chronos:evidence-anchor:synthetic-001",
    "policyDecisionRef": "pending",
    "authorityPlane": "SocioProphet/sociosphere",
    "nonAuthorityDeclaration": "Soft satisfaction score is advisory only; Superconscious does not authorize this claim.",
    "explanationTraceRef": "urn:socioprophet:chronos:explanation-trace:synthetic-001",
    "replayReference": "urn:socioprophet:chronos:replay:synthetic-001"
  }
}
